{
  "sequence": 0,
  "evidence_event_hash": "75e38380712627db05eb0d187f9e2a7ec809c7ab3ea4255bed0c9a96f55a5aa7",
  "git_commit_ref": "a1b2c3d4e5f6a7b8c9d0e1f2a3b4c5d6e7f8a9b0",
  "previous_state_hash": "0000000000000000000000000000000000000000000000000000000000000000",
  "state_hash": "e3b0c44298fc1c149afbf4c8996fb92427ae41e4649b934ca495991b7852b855"
}
