[
  {
    "sequence": 0,
    "evidence_event_hash": "75e38380712627db05eb0d187f9e2a7ec809c7ab3ea4255bed0c9a96f55a5aa7",
    "git_commit_ref": "a1b2c3d4e5f6a7b8c9d0e1f2a3b4c5d6e7f8a9b0",
    "previous_state_hash": "0000000000000000000000000000000000000000000000000000000000000000",
    "state_hash": "33c34dd11e9d7ea0b6bbd2443f0a2c838ce0b05e6fa7feddc0c770d55349b53f"
  },
  {
    "sequence": 1,
    "evidence_event_hash": "f2ff96cbd5d3deb8fcc1b480235ae43648cbab1055369934cfcd48d9454125c3",
    "git_commit_ref": "b2c3d4e5f6a7b8c9d0e1f2a3b4c5d6e7f8a9b0a1",
    "previous_state_hash": "33c34dd11e9d7ea0b6bbd2443f0a2c838ce0b05e6fa7feddc0c770d55349b53f",
    "state_hash": "685473c529dc5910f21a05bcd0026fe70ca26410c634fb254ceceea55e94317e"
  }
]
